### ISSUE TITLE
Timeout after 60 seconds although in the config file it's 5 minutes

### ISSUE THREAD

**Issue by plsdosomething** [newsboat/newsboat#1291]
**Newsboat version (copy the output of `newsboat -v` or the first line of `git show`)**:
newsboat r2.21

Config file (copy from ~/.newsboat/config or ~/.config/newsboat/config):

```
max-items 3000
download-retries 50
download-timeout 300
error-log "~/.newsboat/error.log"
```

Steps to reproduce the issue:

1. Have server who responds after more than one minute 

2. Set dowload-timeout over 60

3. Get following error after 60 seconds: [2020-11-15 09:14:02] Error while retrieving https://*:*@privateuniversityfeed: Server returned nothing (no headers, no data)

I thought that maybe the download-retries were the problem, but after setting it to a high number the problem persisted. And it always stops loading after exactly 60 seconds. I've as well tested if the config file is in the right place by setting the timeout to 13 seconds, which resulted in a timeout after 13 seconds.
The URL to the feed is also correct. After inserting it in a internet browser the feed appears after around 80 seconds. But that's on a sunday morning. During the week it takes longer.

**Comment by Minoru** [comment]
> I've as well tested if the config file is in the right place by setting the timeout to 13 seconds, which resulted in a timeout after 13 seconds.

Does this write *the same error* to the error log? It should say "Timeout reached" instead of "Server returned nothing".

In general, "Server returned nothing" hints that it's the server who closes the connection without responding to Newsboat's request. Since it works in the browser, try making Newsboat mimic your browser:

1. go to https://ifconfig.co/json and copy `user_agent.raw_value` (or find out your browser's User Agent string in any other way);
2. in Newsboat config, add `user-agent "the string you copied"`;
3. start Newsboat and try loading the feed.

(FWIW, I built r2.21 tag from Git, ran `nc -l -p 8123` in a different terminal, and tried to load `http://localhost:8123/test.atom` — Newsboat heeds `download-timeout` as expected.)

**Comment by dennisschagt** [comment]
When comparing a request made by Newsboat and a request made by Firefox, I see two things Firefox does which Newsboat does not:
- Firefox configures TCP keep-alive
- Firefox sends HTTP header "Connection: keep-alive"

@plsdosomething: If you want, you could try compiling Newsboat with the following changes (and test if the issue still exists):
https://github.com/newsboat/newsboat/compare/master...dennisschagt:experimental/issue-1291

**Comment by plsdosomething** [comment]
@Minoru It does not write the same error. With the 13 seconds it says "Timeout was reached".
I tried mimicking the browser as you described, but I get the same error. I don't think the server closes the connection, it just doesn't send anything I'd guess because it is busy generating the feed or is overall overloaded.
Because this error occurs always exactly after 60 seconds of waiting, I thought it must be an internal timer that ends although the download-timeout is set way over 60 seconds.

@dennisschagt I'm not very experienced in compiling/docker and tried what I can and I think it doesn't work. Unfortunately I messed up something with the install using your fork of newsboat. Because of that I manually changed the file on the current master of this repository. "git diff" shows:
```
diff --git a/Makefile b/Makefile
index 7dd50387..bf930b11 100644
--- a/Makefile
+++ b/Makefile
@@ -16,7 +16,7 @@ CXX_FOR_BUILD?=$(CXX)
 # compiler and linker flags
 DEFINES=-DLOCALEDIR=\"$(localedir)\"
 
-WARNFLAGS=-Werror -Wall -Wextra -Wunreachable-code
+WARNFLAGS=-Wall -Wextra -Wunreachable-code
 INCLUDES=-Iinclude -Istfl -Ifilter -I. -Irss
 BARE_CXXFLAGS=-std=c++11 -O2 -ggdb $(INCLUDES)
 LDFLAGS+=-L.
diff --git a/rss/parser.cpp b/rss/parser.cpp
index dd4b6c41..1c01f0d5 100644
--- a/rss/parser.cpp
+++ b/rss/parser.cpp
@@ -144,7 +144,11 @@ Feed Parser::parse_url(const std::string& url,
        if (to != 0) {
                curl_easy_setopt(easyhandle, CURLOPT_TIMEOUT, to);
        }
+       curl_easy_setopt(easyhandle, CURLOPT_TCP_KEEPALIVE, 1);
+       curl_easy_setopt(easyhandle, CURLOPT_TCP_KEEPIDLE, 10);
+       curl_easy_setopt(easyhandle, CURLOPT_TCP_KEEPINTVL, 10);
 
+       custom_headers = curl_slist_append(custom_headers, "Connection: keep-alive");
        if (!prx.empty()) {
                curl_easy_setopt(easyhandle, CURLOPT_PROXY, prx.c_str());
        }

```
(Had to remove "-Werror" from the Makefile because otherwise it wouldn't run "make" without error)
"git show" outputs:
```
Merge: 4fa0572e 93c30263
Author: Alexander Batischev <eual.jp@gmail.com>
Date:   Sun Nov 15 15:17:33 2020 +0300

    Merge pull request #1290 from ATM-SALEH/issue_657_fix
    
    Modify option set for single conflict case while saving feeds
    
    Fixes #657.

```
And "newsboat -v" shows:
```
newsboat r2.21-182-ga3ff6-dirty - https://newsboat.org/
Copyright (C) 2006-2015 Andreas Krennmair
Copyright (C) 2015-2020 Alexander Batischev
Copyright (C) 2006-2017 Newsbeuter contributors
Copyright (C) 2017-2020 Newsboat contributors

Newsboat is free software licensed under the MIT License. (Type `newsboat -vv' to see the full text.)
It bundles:
- JSON for Modern C++ library, licensed under the MIT License: https://github.com/nlohmann/json
- optional-lite library, licensed under the Boost Software License: https://github.com/martinmoene/optional-lite
- expected-lite library, licensed under the Boost Software License: https://github.com/martinmoene/expected-lite

newsboat r2.21-182-ga3ff6-dirty
System: Linux 5.4.0-53-generic (x86_64)
Compiler: g++ 9.3.0
ncurses: ncurses 6.2.20200212 (compiled with 6.2)
libcurl: libcurl/7.68.0 OpenSSL/1.1.1f zlib/1.2.11 brotli/1.0.7 libidn2/2.2.0 libpsl/0.21.0 (+libidn2/2.2.0) libssh/0.9.3/openssl/zlib nghttp2/1.40.0 librtmp/2.3 (compiled with 7.68.0)
SQLite: 3.31.1 (compiled with 3.31.1)
libxml2: compiled with 2.9.10
```
After modifying the Makefile like described above (removing "-Werror") I ran "make" and "sudo make install" to install newsboat. Before "make" I also uninstalled my first installed snap version and my intermediate unlucky tries with the fork with "sudo make uninstall"
I'm relatively sure that the code change you proposed is in the program that I'm running and unfortunately it still doesn't work. Like before after 60 seconds it comes to a break/timeout with the message "Server returned nothing (no headers, no data)"

Idk if the 60 seconds barrier is hardcoded or maybe set automatically by another tool that's used inside. This is the first and until now only feed reader that I found that allows modifying the timeout time which is very useful and hopefully the feed servers are getting a little bit better the next few days so that I can use it. But it seems to have a 60 seconds barrier when the server needs a while to respond. (Idk if they are maybe exchanging messages during the wait time or not, but data isn't sent during the first 60 seconds and because of that the error message "Server returned nothing (no headers, no data)" is shown.)
(and even if this doesn't work out, thank you for this feed reader. It's also the only one I found that can import a xml file and display it properly. That way I can download it from the site and than import it into the reader)

**Comment by Minoru** [comment]
Thanks for the responses! Your patch is indeed equivalent to @dennisschagt's. It's a pity that didn't work.

I have one more idea: add [`always-download "https://:@privateuniversityfeed"`](https://newsboat.org/releases/2.21/docs/newsboat.html#always-download). This prevents Newsboat from sending If-Modified-Since and If-None-Matches HTTP headers. This makes Newsboat look like a client that fetches the feed for the very first time.

> It's also the only one I found that can import a xml file and display it properly. That way I can download it from the site and than import it into the reader

Note that Newsboat has not only the manual OPML import, but also [`opml-url`](https://newsboat.org/releases/2.21/docs/newsboat.html#opml-url), which will download the file for you ;)

Okay, if you're in a mood to drill further into this issue, I suggest you install tcpdump and take a look at the packets that go between your computer and the server. Run something like this:

```
$ sudo tcpdump -i enp59s0 host privateuniversity
```

`enp59s0` is the name of the network interface over which the traffic is flowing (it's probably your Ethernet adapter or a Wi-Fi card, run `ip address` and look for interfaces that are marked "UP" and have a plausible-looking IP address). `privateuniversity` is the name of the *host* from which you get the feed, *not* the full URL.

Run that and go to the website using the browser. `tcpdump` will print out the traffic. Close the browser (not just the tab or the window, but the whole program) to make the connection terminate. Then go refresh that feed in Newsboat, then quit that too. You now have two traffic dumps that should look very similar. Here's a simple example, where I sent a "GET / HTTP/1.1" request, and the server responded with error 400 and closed the connection:

```
19:54:53.041700 IP me.38054 > server.http: Flags [S], seq 119534314, win 64240, options [mss 1460,sackOK,TS val 364343211 ecr 0,nop,wscale 7], length 0
19:54:53.097803 IP server.http > me.38054: Flags [S.], seq 3142432833, ack 119534315, win 65535, options [mss 1460,nop,wscale 6,sackOK,TS val 3167311632 ecr 364343211], length 0
19:54:53.097872 IP me.38054 > server.http: Flags [.], ack 1, win 502, options [nop,nop,TS val 364343267 ecr 3167311632], length 0
19:54:55.517411 IP me.38054 > server.http: Flags [P.], seq 1:16, ack 1, win 502, options [nop,nop,TS val 364345687 ecr 3167311632], length 15: HTTP: GET / HTTP/1.1
19:54:55.679317 IP server.http > me.38054: Flags [.], ack 16, win 1026, options [nop,nop,TS val 3167314214 ecr 364345687], length 0
19:54:55.679371 IP me.38054 > server.http: Flags [P.], seq 16:17, ack 1, win 502, options [nop,nop,TS val 364345849 ecr 3167314214], length 1: HTTP
19:54:55.735711 IP server.http > me.38054: Flags [P.], seq 1:326, ack 17, win 1026, options [nop,nop,TS val 3167314271 ecr 364345849], length 325: HTTP: HTTP/1.1 400 Bad Request
19:54:55.735770 IP me.38054 > server.http: Flags [.], ack 326, win 501, options [nop,nop,TS val 364345905 ecr 3167314271], length 0
19:54:55.735828 IP server.http > me.38054: Flags [F.], seq 326, ack 17, win 1026, options [nop,nop,TS val 3167314271 ecr 364345849], length 0
19:54:55.735901 IP me.38054 > server.http: Flags [F.], seq 17, ack 327, win 501, options [nop,nop,TS val 364345905 ecr 3167314271], length 0
19:54:55.792540 IP server.http > me.38054: Flags [.], ack 18, win 1026, options [nop,nop,TS val 3167314327 ecr 364345905], length 0
```

Note the last three lines: the server sent a FIN packet (indicated by `[F.]`), I responded with another FIN, and the server fully closed the connection with ACK (`[.]`). Here's how a Newsboat timeout look like:

```
20:04:34.225021 IP me.43448 > server.80: Flags [S], seq 1875901134, win 65495, options [mss 65495,sackOK,TS val 168350422 ecr 0,nop,wscale 7], length 0
20:04:34.225045 IP server.80 > me.43448: Flags [S.], seq 2487966981, ack 1875901135, win 65483, options [mss 65495,sackOK,TS val 168350422 ecr 168350422,nop,wscale 7], length 0
20:04:34.225065 IP me.43448 > server.80: Flags [.], ack 1, win 512, options [nop,nop,TS val 168350422 ecr 168350422], length 0
20:04:34.225157 IP me.43448 > server.80: Flags [P.], seq 1:138, ack 1, win 512, options [nop,nop,TS val 168350422 ecr 168350422], length 137
20:04:34.225169 IP server.80 > me.43448: Flags [.], ack 138, win 511, options [nop,nop,TS val 168350422 ecr 168350422], length 0
20:04:36.225652 IP me.43448 > server.80: Flags [F.], seq 138, ack 1, win 512, options [nop,nop,TS val 168352423 ecr 168350422], length 0
20:04:36.225765 IP server.80 > me.43448: Flags [F.], seq 1, ack 139, win 512, options [nop,nop,TS val 168352423 ecr 168352423], length 0
20:04:36.225813 IP me.43448 > server.80: Flags [.], ack 2, win 512, options [nop,nop,TS val 168352423 ecr 168352423], length 0
```

Last three lines show it clearly: it's "me", i.e. Newsboat, who initiates the disconnect.

You can do the same, and analyse the logs. If you can pinpoint the three lines that show the disconnect, you can show those to us. To my knowledge, the only sensitive info in there is the time, the hostnames/IPs ("me" and "server" above), and data (like "GET / HTTP.1.1" in my previous listing).

This will tell us exactly who closes the connection, but probably not much else :( But at least we'll know who is to blame: the server or the client.

**Comment by dennisschagt** [comment]
> I'm relatively sure that the code change you proposed is in the program that I'm running and unfortunately it still doesn't work.

Thank you for testing the idea!

> After modifying the Makefile like described above (removing "-Werror") I ran "make" and "sudo make install" to install newsboat. 

A small note: You can run Newsboat directly from the source directory without installing it (just execute `./newsboat`).

Like Minoru, I think it is likely that the server is closing the connection after 60 seconds.
I tested Newsboat with a small HTTPS server which waits for 60 seconds and then closes the connection without sending any data.
This can be seen in Wireshark (or with `tcpdump`) as a TCP `FIN` packet transmitted by the server (after ~60 seconds).
It results in the following error in Newsboat: 
`Error while retrieving https://10.0.0.1:9000/test.rss: Server returned nothing (no headers, no data)`
![image](https://user-images.githubusercontent.com/4629607/99321467-2956cc80-286e-11eb-9092-1b0d7adad0f8.png)

When increasing the waiting time in the HTTPS server to 500 seconds, I don't see the same issue.
In that case, Newsboat waits the full 300 seconds (because of `download-timeout 300`) before closing the connection and shows a "timeout" error instead:
`Error while retrieving https://10.0.0.1:9000/test.rss: Timeout was reached`
![image](https://user-images.githubusercontent.com/4629607/99320874-dcbec180-286c-11eb-9e4b-7f9217d3590a.png)

Some notes:
- In my test, Newsboat is running on my PC with IP address 10.0.0.2. The HTTPS server has IP address 10.0.0.1.
- I disabled the TCP keep-alive. When it is enabled, packets are send every 10 seconds:
![image](https://user-images.githubusercontent.com/4629607/99322001-5ce62680-286f-11eb-8f0d-e946de60b9c9.png)

**Comment by plsdosomething** [comment]
Thank you very much for your answers.
I think I got the problem. It's my VPN because of some strange reasons. When I'm connected to it, the server closes the newsboat connection after 60 seconds, but allows the browser connection to operate normally.
When I'm not connected with the VPN both works fine. I didn't think about it before because the browser loading worked but I tested it with tcpdump and in fact the server closes the newsboat connection.
tcpdump from loading it with Firefox and VPN enabled:
```
sudo tcpdump -i tun0 host server.edu
tcpdump: verbose output suppressed, use -v or -vv for full protocol decode
listening on tun0, link-type RAW (Raw IP), capture size 262144 bytes
09:34:43.219002 IP me.38120 > server.edu.https: Flags [S], seq 1592575488, win 64240, options [mss 1460,sackOK,TS val 2034225928 ecr 0,nop,wscale 7], length 0
09:34:43.247838 IP server.edu.https > me.38120: Flags [S.], seq 2463574689, ack 1592575489, win 28960, options [mss 1328,sackOK,TS val 316788885 ecr 2034225928,nop,wscale 9], length 0
09:34:43.247873 IP me.38120 > server.edu.https: Flags [.], ack 1, win 502, options [nop,nop,TS val 2034225956 ecr 316788885], length 0
09:34:43.251302 IP me.38120 > server.edu.https: Flags [P.], seq 1:518, ack 1, win 502, options [nop,nop,TS val 2034225960 ecr 316788885], length 517
09:34:43.273837 IP server.edu.https > me.38120: Flags [.], ack 518, win 59, options [nop,nop,TS val 316788911 ecr 2034225960], length 0
09:34:43.299097 IP server.edu.https > me.38120: Flags [.], seq 1:1317, ack 518, win 59, options [nop,nop,TS val 316788936 ecr 2034225960], length 1316
09:34:43.299117 IP me.38120 > server.edu.https: Flags [.], ack 1317, win 501, options [nop,nop,TS val 2034226008 ecr 316788936], length 0
09:34:43.299136 IP server.edu.https > me.38120: Flags [P.], seq 1317:1369, ack 518, win 59, options [nop,nop,TS val 316788936 ecr 2034225960], length 52
09:34:43.573188 IP server.edu.https > me.38120: Flags [.], ack 1111, win 63, options [nop,nop,TS val 316789210 ecr 2034226214], length 0
09:34:43.600416 IP server.edu.https > me.38120: Flags [P.], seq 7263:7435, ack 1111, win 63, options [nop,nop,TS val 316789238 ecr 2034226214], length 172
09:34:43.600446 IP me.38120 > server.edu.https: Flags [.], ack 7435, win 501, options [nop,nop,TS val 2034226309 ecr 316789238], length 0
09:34:45.638756 IP me.38120 > server.edu.https: Flags [P.], seq 1111:1286, ack 7435, win 501, options [nop,nop,TS val 2034228347 ecr 316789238], length 175
09:34:45.650945 IP server.edu.https > me.38120: Flags [.], ack 1286, win 65, options [nop,nop,TS val 316791288 ecr 2034228347], length 0
09:35:42.531792 IP me.38120 > server.edu.https: Flags [P.], seq 1286:1325, ack 7435, win 501, options [nop,nop,TS val 2034285240 ecr 316791288], length 39
09:35:42.545731 IP server.edu.https > me.38120: Flags [.], ack 1325, win 65, options [nop,nop,TS val 316848182 ecr 2034285240], length 0
09:35:42.635397 IP server.edu.https > me.38120: Flags [P.], seq 7435:7474, ack 1325, win 65, options [nop,nop,TS val 316848272 ecr 2034285240], length 39
09:35:42.635428 IP me.38120 > server.edu.https: Flags [.], ack 7474, win 501, options [nop,nop,TS val 2034285344 ecr 316848272], length 0
09:36:10.687581 IP server.edu.https > me.38120: Flags [P.], seq 7474:7572, ack 1325, win 65, options [nop,nop,TS val 316876324 ecr 2034285344], length 98
09:36:10.687614 IP me.38120 > server.edu.https: Flags [.], ack 7572, win 501, options [nop,nop,TS val 2034313396 ecr 316876324], length 0
09:36:10.687752 IP server.edu.https > me.38120: Flags [.], seq 7572:8888, ack 1325, win 65, options [nop,nop,TS val 316876324 ecr 2034285344], length 1316
09:36:10.687769 IP me.38120 > server.edu.https: Flags [.], ack 8888, win 498, options [nop,nop,TS val 2034313396 ecr 316876324], length 0
09:36:10.687977 IP server.edu.https > me.38120: Flags [.], seq 8888:10204, ack 1325, win 65, options [nop,nop,TS val 316876324 ecr 2034285344], length 1316
09:36:10.687991 IP me.38120 > server.edu.https: Flags [.], ack 10204, win 494, options [nop,nop,TS val 2034313397 ecr 316876324], length 0
09:36:10.688004 IP server.edu.https > me.38120: Flags [P.], seq 10204:10308, ack 1325, win 65, options [nop,nop,TS val 316876324 ecr 2034285344], length 104
09:36:10.688010 IP me.38120 > server.edu.https: Flags [.], ack 10308, win 494, options [nop,nop,TS val 2034313397 ecr 316876324], length 0
09:36:10.688203 IP server.edu.https > me.38120: Flags [.], seq 10308:11624, ack 1325, win 65, options [nop,nop,TS val 316876324 ecr 2034285344], length 1316
09:36:10.688214 IP me.38120 > server.edu.https: Flags [.], ack 11624, win 501, options [nop,nop,TS val 2034313397 ecr 316876324], length 0
09:36:10.688272 IP server.edu.https > me.38120: Flags [.], seq 11624:12940, ack 1325, win 65, options [nop,nop,TS val 316876324 ecr 2034285344], length 1316
09:36:10.688292 IP me.38120 > server.edu.https: Flags [.], ack 12940, win 491, options [nop,nop,TS val 2034313397 ecr 316876324], length 0
09:36:10.688339 IP server.edu.https > me.38120: Flags [.], seq 12940:14256, ack 1325, win 65, options [nop,nop,TS val 316876324 ecr 2034285344], length 1316
09:36:10.688349 IP me.38120 > server.edu.https: Flags [.], ack 14256, win 485, options [nop,nop,TS val 2034313397 ecr 316876324], length 0
09:36:10.688565 IP server.edu.https > me.38120: Flags [.], seq 14256:15572, ack 1325, win 65, options [nop,nop,TS val 316876324 ecr 2034285344], length 1316
09:36:10.688576 IP me.38120 > server.edu.https: Flags [.], ack 15572, win 501, options [nop,nop,TS val 2034313397 ecr 316876324], length 0
09:36:10.688815 IP server.edu.https > me.38120: Flags [.], seq 15572:16888, ack 1325, win 65, options [nop,nop,TS val 316876324 ecr 2034285344], length 1316
09:36:10.688825 IP me.38120 > server.edu.https: Flags [.], ack 16888, win 501, options [nop,nop,TS val 2034313397 ecr 316876324], length 0
09:36:10.689071 IP server.edu.https > me.38120: Flags [P.], seq 16888:18148, ack 1325, win 65, options [nop,nop,TS val 316876324 ecr 2034285344], length 1260
09:36:10.689081 IP me.38120 > server.edu.https: Flags [.], ack 18148, win 501, options [nop,nop,TS val 2034313398 ecr 316876324], length 0
09:36:10.689896 IP server.edu.https > me.38120: Flags [.], seq 18148:19464, ack 1325, win 65, options [nop,nop,TS val 316876325 ecr 2034285344], length 1316
09:36:10.689914 IP me.38120 > server.edu.https: Flags [.], ack 19464, win 501, options [nop,nop,TS val 2034313398 ecr 316876325], length 0
09:36:10.689931 IP server.edu.https > me.38120: Flags [P.], seq 19464:19516, ack 1325, win 65, options [nop,nop,TS val 316876325 ecr 2034285344], length 52
09:36:10.689937 IP me.38120 > server.edu.https: Flags [.], ack 19516, win 501, options [nop,nop,TS val 2034313398 ecr 316876325], length 0
09:36:10.706712 IP server.edu.https > me.38120: Flags [.], seq 19516:20832, ack 1325, win 65, options [nop,nop,TS val 316876343 ecr 2034285344], length 1316
09:36:10.706731 IP me.38120 > server.edu.https: Flags [.], ack 20832, win 501, options [nop,nop,TS val 2034313415 ecr 316876343], length 0
09:36:10.706925 IP server.edu.https > me.38120: Flags [.], seq 20832:22148, ack 1325, win 65, options [nop,nop,TS val 316876343 ecr 2034285344], length 1316
09:36:10.706933 IP me.38120 > server.edu.https: Flags [.], ack 22148, win 501, options [nop,nop,TS val 2034313415 ecr 316876343], length 0
09:36:10.706942 IP server.edu.https > me.38120: Flags [P.], seq 22148:22252, ack 1325, win 65, options [nop,nop,TS val 316876343 ecr 2034285344], length 104
09:36:10.706945 IP me.38120 > server.edu.https: Flags [.], ack 22252, win 501, options [nop,nop,TS val 2034313415 ecr 316876343], length 0
09:36:10.707193 IP server.edu.https > me.38120: Flags [.], seq 22252:23568, ack 1325, win 65, options [nop,nop,TS val 316876343 ecr 2034285344], length 1316
09:36:10.707201 IP me.38120 > server.edu.https: Flags [.], ack 23568, win 501, options [nop,nop,TS val 2034313416 ecr 316876343], length 0
09:36:10.707442 IP server.edu.https > me.38120: Flags [.], seq 23568:24884, ack 1325, win 65, options [nop,nop,TS val 316876343 ecr 2034285344], length 1316
09:36:10.707511 IP server.edu.https > me.38120: Flags [P.], seq 24884:24988, ack 1325, win 65, options [nop,nop,TS val 316876343 ecr 2034285344], length 104
09:36:10.707521 IP me.38120 > server.edu.https: Flags [.], ack 24988, win 501, options [nop,nop,TS val 2034313416 ecr 316876343], length 0
09:36:10.707737 IP server.edu.https > me.38120: Flags [.], seq 24988:26304, ack 1325, win 65, options [nop,nop,TS val 316876343 ecr 2034285344], length 1316
09:36:10.707965 IP server.edu.https > me.38120: Flags [.], seq 26304:27620, ack 1325, win 65, options [nop,nop,TS val 316876343 ecr 2034285344], length 1316
09:36:10.707972 IP me.38120 > server.edu.https: Flags [.], ack 27620, win 501, options [nop,nop,TS val 2034313417 ecr 316876343], length 0
09:36:10.708350 IP server.edu.https > me.38120: Flags [.], seq 27620:28936, ack 1325, win 65, options [nop,nop,TS val 316876344 ecr 2034285344], length 1316
09:36:10.708601 IP server.edu.https > me.38120: Flags [.], seq 28936:30252, ack 1325, win 65, options [nop,nop,TS val 316876344 ecr 2034285344], length 1316
09:36:10.708612 IP me.38120 > server.edu.https: Flags [.], ack 30252, win 501, options [nop,nop,TS val 2034313417 ecr 316876344], length 0
09:36:10.709223 IP server.edu.https > me.38120: Flags [.], seq 30252:31568, ack 1325, win 65, options [nop,nop,TS val 316876344 ecr 2034313396], length 1316
09:36:10.709439 IP server.edu.https > me.38120: Flags [.], seq 31568:32884, ack 1325, win 65, options [nop,nop,TS val 316876344 ecr 2034313396], length 1316
09:36:10.709447 IP me.38120 > server.edu.https: Flags [.], ack 32884, win 524, options [nop,nop,TS val 2034313418 ecr 316876344], length 0
09:36:10.744026 IP server.edu.https > me.38120: Flags [.], seq 32884:34200, ack 1325, win 65, options [nop,nop,TS val 316876380 ecr 2034313417], length 1316
09:36:10.744049 IP me.38120 > server.edu.https: Flags [.], ack 34200, win 546, options [nop,nop,TS val 2034313453 ecr 316876380], length 0
09:36:10.744228 IP server.edu.https > me.38120: Flags [.], seq 34200:35516, ack 1325, win 65, options [nop,nop,TS val 316876380 ecr 2034313417], length 1316
09:36:10.744236 IP me.38120 > server.edu.https: Flags [.], ack 35516, win 569, options [nop,nop,TS val 2034313453 ecr 316876380], length 0
09:36:10.744451 IP server.edu.https > me.38120: Flags [.], seq 35516:36832, ack 1325, win 65, options [nop,nop,TS val 316876380 ecr 2034313418], length 1316
09:36:10.744459 IP me.38120 > server.edu.https: Flags [.], ack 36832, win 592, options [nop,nop,TS val 2034313453 ecr 316876380], length 0
09:36:10.744702 IP server.edu.https > me.38120: Flags [.], seq 36832:38148, ack 1325, win 65, options [nop,nop,TS val 316876380 ecr 2034313418], length 1316
09:36:10.744710 IP me.38120 > server.edu.https: Flags [.], ack 38148, win 614, options [nop,nop,TS val 2034313453 ecr 316876380], length 0
09:36:10.759004 IP server.edu.https > me.38120: Flags [.], seq 38148:39464, ack 1325, win 65, options [nop,nop,TS val 316876395 ecr 2034313453], length 1316
09:36:10.759025 IP me.38120 > server.edu.https: Flags [.], ack 39464, win 637, options [nop,nop,TS val 2034313468 ecr 316876395], length 0
09:36:10.759180 IP server.edu.https > me.38120: Flags [.], seq 39464:40780, ack 1325, win 65, options [nop,nop,TS val 316876395 ecr 2034313453], length 1316
09:36:10.759189 IP me.38120 > server.edu.https: Flags [.], ack 40780, win 660, options [nop,nop,TS val 2034313468 ecr 316876395], length 0
09:36:10.759587 IP server.edu.https > me.38120: Flags [.], seq 40780:42096, ack 1325, win 65, options [nop,nop,TS val 316876395 ecr 2034313453], length 1316
09:36:10.759598 IP me.38120 > server.edu.https: Flags [.], ack 42096, win 682, options [nop,nop,TS val 2034313468 ecr 316876395], length 0
09:36:10.759883 IP server.edu.https > me.38120: Flags [.], seq 42096:43412, ack 1325, win 65, options [nop,nop,TS val 316876395 ecr 2034313453], length 1316
09:36:10.759893 IP me.38120 > server.edu.https: Flags [.], ack 43412, win 705, options [nop,nop,TS val 2034313468 ecr 316876395], length 0
09:36:10.815331 IP server.edu.https > me.38120: Flags [.], seq 43412:44728, ack 1325, win 65, options [nop,nop,TS val 316876452 ecr 2034313453], length 1316
09:36:10.815350 IP me.38120 > server.edu.https: Flags [.], ack 44728, win 727, options [nop,nop,TS val 2034313524 ecr 316876452], length 0
09:36:10.827270 IP server.edu.https > me.38120: Flags [.], seq 44728:46044, ack 1325, win 65, options [nop,nop,TS val 316876464 ecr 2034313524], length 1316
09:36:10.827277 IP me.38120 > server.edu.https: Flags [.], ack 46044, win 750, options [nop,nop,TS val 2034313536 ecr 316876464], length 0
09:36:10.827495 IP server.edu.https > me.38120: Flags [.], seq 46044:47360, ack 1325, win 65, options [nop,nop,TS val 316876464 ecr 2034313524], length 1316
09:36:10.827502 IP me.38120 > server.edu.https: Flags [.], ack 47360, win 773, options [nop,nop,TS val 2034313536 ecr 316876464], length 0
09:36:10.827744 IP server.edu.https > me.38120: Flags [.], seq 47360:48676, ack 1325, win 65, options [nop,nop,TS val 316876464 ecr 2034313524], length 1316
09:36:10.827752 IP me.38120 > server.edu.https: Flags [.], ack 48676, win 795, options [nop,nop,TS val 2034313536 ecr 316876464], length 0
09:36:10.827995 IP server.edu.https > me.38120: Flags [.], seq 48676:49992, ack 1325, win 65, options [nop,nop,TS val 316876464 ecr 2034313524], length 1316
09:36:10.828003 IP me.38120 > server.edu.https: Flags [.], ack 49992, win 818, options [nop,nop,TS val 2034313537 ecr 316876464], length 0
09:36:10.845728 IP server.edu.https > me.38120: Flags [.], seq 49992:51308, ack 1325, win 65, options [nop,nop,TS val 316876482 ecr 2034313536], length 1316
09:36:10.845753 IP me.38120 > server.edu.https: Flags [.], ack 51308, win 841, options [nop,nop,TS val 2034313554 ecr 316876482], length 0
09:36:10.845972 IP server.edu.https > me.38120: Flags [.], seq 51308:52624, ack 1325, win 65, options [nop,nop,TS val 316876482 ecr 2034313536], length 1316
09:36:10.846000 IP me.38120 > server.edu.https: Flags [.], ack 52624, win 863, options [nop,nop,TS val 2034313555 ecr 316876482], length 0
09:36:10.846225 IP server.edu.https > me.38120: Flags [.], seq 52624:53940, ack 1325, win 65, options [nop,nop,TS val 316876482 ecr 2034313536], length 1316
09:36:10.846244 IP me.38120 > server.edu.https: Flags [.], ack 53940, win 886, options [nop,nop,TS val 2034313555 ecr 316876482], length 0
09:36:10.846443 IP server.edu.https > me.38120: Flags [.], seq 53940:55256, ack 1325, win 65, options [nop,nop,TS val 316876482 ecr 2034313537], length 1316
09:36:10.846460 IP me.38120 > server.edu.https: Flags [.], ack 55256, win 908, options [nop,nop,TS val 2034313555 ecr 316876482], length 0
09:36:10.859684 IP server.edu.https > me.38120: Flags [.], seq 55256:56572, ack 1325, win 65, options [nop,nop,TS val 316876496 ecr 2034313554], length 1316
09:36:10.859706 IP me.38120 > server.edu.https: Flags [.], ack 56572, win 931, options [nop,nop,TS val 2034313568 ecr 316876496], length 0
09:36:10.859936 IP server.edu.https > me.38120: Flags [.], seq 56572:57888, ack 1325, win 65, options [nop,nop,TS val 316876496 ecr 2034313555], length 1316
09:36:10.859959 IP me.38120 > server.edu.https: Flags [.], ack 57888, win 954, options [nop,nop,TS val 2034313568 ecr 316876496], length 0
09:36:10.860145 IP server.edu.https > me.38120: Flags [.], seq 57888:59204, ack 1325, win 65, options [nop,nop,TS val 316876496 ecr 2034313555], length 1316
09:36:10.860162 IP me.38120 > server.edu.https: Flags [.], ack 59204, win 976, options [nop,nop,TS val 2034313569 ecr 316876496], length 0
09:36:10.860419 IP server.edu.https > me.38120: Flags [.], seq 59204:60520, ack 1325, win 65, options [nop,nop,TS val 316876496 ecr 2034313555], length 1316
09:36:10.860438 IP me.38120 > server.edu.https: Flags [.], ack 60520, win 999, options [nop,nop,TS val 2034313569 ecr 316876496], length 0
09:36:10.870252 IP server.edu.https > me.38120: Flags [.], seq 60520:61836, ack 1325, win 65, options [nop,nop,TS val 316876507 ecr 2034313568], length 1316
09:36:10.870269 IP me.38120 > server.edu.https: Flags [.], ack 61836, win 1022, options [nop,nop,TS val 2034313579 ecr 316876507], length 0
09:36:10.870692 IP server.edu.https > me.38120: Flags [.], seq 61836:63152, ack 1325, win 65, options [nop,nop,TS val 316876507 ecr 2034313569], length 1316
09:36:10.870706 IP me.38120 > server.edu.https: Flags [.], ack 63152, win 1044, options [nop,nop,TS val 2034313579 ecr 316876507], length 0
09:36:10.870915 IP server.edu.https > me.38120: Flags [.], seq 63152:64468, ack 1325, win 65, options [nop,nop,TS val 316876507 ecr 2034313569], length 1316
09:36:10.870930 IP me.38120 > server.edu.https: Flags [.], ack 64468, win 1067, options [nop,nop,TS val 2034313579 ecr 316876507], length 0
09:36:10.878242 IP server.edu.https > me.38120: Flags [.], seq 64468:65784, ack 1325, win 65, options [nop,nop,TS val 316876515 ecr 2034313569], length 1316
09:36:10.878265 IP me.38120 > server.edu.https: Flags [.], ack 65784, win 1089, options [nop,nop,TS val 2034313587 ecr 316876515], length 0
09:36:10.885111 IP server.edu.https > me.38120: Flags [.], seq 65784:67100, ack 1325, win 65, options [nop,nop,TS val 316876521 ecr 2034313579], length 1316
09:36:10.885141 IP me.38120 > server.edu.https: Flags [.], ack 67100, win 1112, options [nop,nop,TS val 2034313594 ecr 316876521], length 0
09:36:10.885536 IP server.edu.https > me.38120: Flags [.], seq 67100:68416, ack 1325, win 65, options [nop,nop,TS val 316876521 ecr 2034313579], length 1316
09:36:10.885565 IP me.38120 > server.edu.https: Flags [.], ack 68416, win 1135, options [nop,nop,TS val 2034313594 ecr 316876521], length 0
09:36:10.885802 IP server.edu.https > me.38120: Flags [.], seq 68416:69732, ack 1325, win 65, options [nop,nop,TS val 316876521 ecr 2034313579], length 1316
09:36:10.885830 IP me.38120 > server.edu.https: Flags [.], ack 69732, win 1157, options [nop,nop,TS val 2034313594 ecr 316876521], length 0
09:36:10.898117 IP server.edu.https > me.38120: Flags [.], seq 69732:71048, ack 1325, win 65, options [nop,nop,TS val 316876535 ecr 2034313587], length 1316
09:36:10.898137 IP me.38120 > server.edu.https: Flags [.], ack 71048, win 1180, options [nop,nop,TS val 2034313607 ecr 316876535], length 0
09:36:10.910268 IP server.edu.https > me.38120: Flags [.], seq 71048:72364, ack 1325, win 65, options [nop,nop,TS val 316876547 ecr 2034313594], length 1316
09:36:10.910286 IP me.38120 > server.edu.https: Flags [.], ack 72364, win 1203, options [nop,nop,TS val 2034313619 ecr 316876547], length 0
09:36:10.910838 IP server.edu.https > me.38120: Flags [.], seq 72364:73680, ack 1325, win 65, options [nop,nop,TS val 316876547 ecr 2034313594], length 1316
09:36:10.910854 IP me.38120 > server.edu.https: Flags [.], ack 73680, win 1225, options [nop,nop,TS val 2034313619 ecr 316876547], length 0
09:36:10.911093 IP server.edu.https > me.38120: Flags [.], seq 73680:74996, ack 1325, win 65, options [nop,nop,TS val 316876547 ecr 2034313594], length 1316
09:36:10.911115 IP me.38120 > server.edu.https: Flags [.], ack 74996, win 1248, options [nop,nop,TS val 2034313620 ecr 316876547], length 0
09:36:10.920021 IP server.edu.https > me.38120: Flags [.], seq 74996:76312, ack 1325, win 65, options [nop,nop,TS val 316876556 ecr 2034313607], length 1316
09:36:10.920042 IP me.38120 > server.edu.https: Flags [.], ack 76312, win 1270, options [nop,nop,TS val 2034313629 ecr 316876556], length 0
09:36:10.943389 IP server.edu.https > me.38120: Flags [.], seq 76312:77628, ack 1325, win 65, options [nop,nop,TS val 316876580 ecr 2034313619], length 1316
09:36:10.943420 IP me.38120 > server.edu.https: Flags [.], ack 77628, win 1293, options [nop,nop,TS val 2034313652 ecr 316876580], length 0
09:36:10.943612 IP server.edu.https > me.38120: Flags [.], seq 77628:78944, ack 1325, win 65, options [nop,nop,TS val 316876580 ecr 2034313619], length 1316
09:36:10.943625 IP me.38120 > server.edu.https: Flags [.], ack 78944, win 1316, options [nop,nop,TS val 2034313652 ecr 316876580], length 0
09:36:10.943852 IP server.edu.https > me.38120: Flags [.], seq 78944:80260, ack 1325, win 65, options [nop,nop,TS val 316876580 ecr 2034313619], length 1316
09:36:10.943874 IP me.38120 > server.edu.https: Flags [.], ack 80260, win 1338, options [nop,nop,TS val 2034313652 ecr 316876580], length 0
09:36:10.944091 IP server.edu.https > me.38120: Flags [.], seq 80260:81576, ack 1325, win 65, options [nop,nop,TS val 316876580 ecr 2034313619], length 1316
09:36:10.944109 IP me.38120 > server.edu.https: Flags [.], ack 81576, win 1361, options [nop,nop,TS val 2034313653 ecr 316876580], length 0
09:36:10.944896 IP server.edu.https > me.38120: Flags [.], seq 81576:82892, ack 1325, win 65, options [nop,nop,TS val 316876580 ecr 2034313619], length 1316
09:36:10.944914 IP me.38120 > server.edu.https: Flags [.], ack 82892, win 1384, options [nop,nop,TS val 2034313653 ecr 316876580], length 0
09:36:10.945196 IP server.edu.https > me.38120: Flags [.], seq 82892:84208, ack 1325, win 65, options [nop,nop,TS val 316876580 ecr 2034313619], length 1316
09:36:10.945214 IP me.38120 > server.edu.https: Flags [.], ack 84208, win 1406, options [nop,nop,TS val 2034313654 ecr 316876580], length 0
09:36:10.945763 IP server.edu.https > me.38120: Flags [.], seq 84208:85524, ack 1325, win 65, options [nop,nop,TS val 316876580 ecr 2034313620], length 1316
09:36:10.945776 IP me.38120 > server.edu.https: Flags [.], ack 85524, win 1429, options [nop,nop,TS val 2034313654 ecr 316876580], length 0
09:36:10.946008 IP server.edu.https > me.38120: Flags [.], seq 85524:86840, ack 1325, win 65, options [nop,nop,TS val 316876580 ecr 2034313620], length 1316
09:36:10.946019 IP me.38120 > server.edu.https: Flags [.], ack 86840, win 1451, options [nop,nop,TS val 2034313655 ecr 316876580], length 0
09:36:10.946657 IP server.edu.https > me.38120: Flags [.], seq 86840:88156, ack 1325, win 65, options [nop,nop,TS val 316876581 ecr 2034313620], length 1316
09:36:10.946668 IP me.38120 > server.edu.https: Flags [.], ack 88156, win 1474, options [nop,nop,TS val 2034313655 ecr 316876581], length 0
09:36:10.946834 IP server.edu.https > me.38120: Flags [P.], seq 88156:88271, ack 1325, win 65, options [nop,nop,TS val 316876581 ecr 2034313620], length 115
09:36:10.946891 IP me.38120 > server.edu.https: Flags [.], ack 88271, win 1474, options [nop,nop,TS val 2034313655 ecr 316876581], length 0
09:36:11.436022 IP me.38120 > server.edu.https: Flags [P.], seq 1325:1543, ack 88271, win 1474, options [nop,nop,TS val 2034314145 ecr 316876581], length 218
09:36:11.436512 IP me.38120 > server.edu.https: Flags [P.], seq 1543:1578, ack 88271, win 1474, options [nop,nop,TS val 2034314145 ecr 316876581], length 35
09:36:11.452361 IP server.edu.https > me.38120: Flags [.], ack 1543, win 68, options [nop,nop,TS val 316877089 ecr 2034314145], length 0
09:36:11.452478 IP server.edu.https > me.38120: Flags [.], ack 1578, win 68, options [nop,nop,TS val 316877089 ecr 2034314145], length 0
09:36:11.471371 IP server.edu.https > me.38120: Flags [P.], seq 88271:88306, ack 1578, win 68, options [nop,nop,TS val 316877108 ecr 2034314145], length 35
09:36:11.471401 IP me.38120 > server.edu.https: Flags [.], ack 88306, win 1474, options [nop,nop,TS val 2034314180 ecr 316877108], length 0
09:36:16.443657 IP me.38120 > server.edu.https: Flags [P.], seq 1578:1617, ack 88306, win 1474, options [nop,nop,TS val 2034319152 ecr 316877108], length 39
09:36:16.444089 IP me.38120 > server.edu.https: Flags [P.], seq 1617:1641, ack 88306, win 1474, options [nop,nop,TS val 2034319153 ecr 316877108], length 24
09:36:16.444104 IP me.38120 > server.edu.https: Flags [F.], seq 1641, ack 88306, win 1474, options [nop,nop,TS val 2034319153 ecr 316877108], length 0
09:36:16.463291 IP server.edu.https > me.38120: Flags [.], ack 1641, win 68, options [nop,nop,TS val 316882100 ecr 2034319152], length 0
09:36:16.472132 IP server.edu.https > me.38120: Flags [P.], seq 88306:88352, ack 1642, win 68, options [nop,nop,TS val 316882109 ecr 2034319153], length 46
09:36:16.472183 IP me.38120 > server.edu.https: Flags [R], seq 1592577130, win 0, length 0
09:36:16.472205 IP server.edu.https > me.38120: Flags [F.], seq 88352:88376, ack 1642, win 68, options [nop,nop,TS val 316882109 ecr 2034319153], length 24
09:36:16.472216 IP me.38120 > server.edu.https: Flags [R], seq 1592577130, win 0, length 0
```
The tcpdump with newsboat on the other side (same VPN connection) shows this:
```
sudo tcpdump -i tun0 host server.edu
tcpdump: verbose output suppressed, use -v or -vv for full protocol decode
listening on tun0, link-type RAW (Raw IP), capture size 262144 bytes
09:37:25.017219 IP me.38144 > server.edu.https: Flags [S], seq 4231665480, win 64240, options [mss 1460,sackOK,TS val 2034387726 ecr 0,nop,wscale 7], length 0
09:37:25.028144 IP server.edu.https > me.38144: Flags [S.], seq 3051802658, ack 4231665481, win 28960, options [mss 1328,sackOK,TS val 316950664 ecr 2034387726,nop,wscale 9], length 0
09:37:25.028203 IP me.38144 > server.edu.https: Flags [.], ack 1, win 502, options [nop,nop,TS val 2034387737 ecr 316950664], length 0
09:37:25.039027 IP me.38144 > server.edu.https: Flags [P.], seq 1:518, ack 1, win 502, options [nop,nop,TS val 2034387748 ecr 316950664], length 517
09:37:25.058531 IP server.edu.https > me.38144: Flags [.], ack 518, win 59, options [nop,nop,TS val 316950695 ecr 2034387748], length 0
09:37:25.072069 IP server.edu.https > me.38144: Flags [.], seq 1:1317, ack 518, win 59, options [nop,nop,TS val 316950708 ecr 2034387748], length 1316
09:37:25.072091 IP me.38144 > server.edu.https: Flags [.], ack 1317, win 501, options [nop,nop,TS val 2034387781 ecr 316950708], length 0
09:37:25.072289 IP server.edu.https > me.38144: Flags [.], seq 1317:2633, ack 518, win 59, options [nop,nop,TS val 316950708 ecr 2034387748], length 1316
09:37:25.072309 IP me.38144 > server.edu.https: Flags [.], ack 2633, win 494, options [nop,nop,TS val 2034387781 ecr 316950708], length 0
09:37:25.072333 IP server.edu.https > me.38144: Flags [P.], seq 2633:2737, ack 518, win 59, options [nop,nop,TS val 316950708 ecr 2034387748], length 104
09:37:25.072348 IP me.38144 > server.edu.https: Flags [.], ack 2737, win 494, options [nop,nop,TS val 2034387781 ecr 316950708], length 0
09:37:25.072590 IP server.edu.https > me.38144: Flags [.], seq 2737:4053, ack 518, win 59, options [nop,nop,TS val 316950708 ecr 2034387748], length 1316
09:37:25.072604 IP me.38144 > server.edu.https: Flags [.], ack 4053, win 501, options [nop,nop,TS val 2034387781 ecr 316950708], length 0
09:37:25.072623 IP server.edu.https > me.38144: Flags [P.], seq 4053:4097, ack 518, win 59, options [nop,nop,TS val 316950708 ecr 2034387748], length 44
09:37:25.072631 IP me.38144 > server.edu.https: Flags [.], ack 4097, win 501, options [nop,nop,TS val 2034387781 ecr 316950708], length 0
09:37:25.073011 IP server.edu.https > me.38144: Flags [.], seq 4097:5413, ack 518, win 59, options [nop,nop,TS val 316950709 ecr 2034387748], length 1316
09:37:25.073026 IP me.38144 > server.edu.https: Flags [.], ack 5413, win 501, options [nop,nop,TS val 2034387782 ecr 316950709], length 0
09:37:25.073259 IP server.edu.https > me.38144: Flags [P.], seq 5413:6646, ack 518, win 59, options [nop,nop,TS val 316950709 ecr 2034387748], length 1233
09:37:25.073275 IP me.38144 > server.edu.https: Flags [.], ack 6646, win 501, options [nop,nop,TS val 2034387782 ecr 316950709], length 0
09:37:25.074516 IP me.38144 > server.edu.https: Flags [P.], seq 518:598, ack 6646, win 501, options [nop,nop,TS val 2034387783 ecr 316950709], length 80
09:37:25.074689 IP me.38144 > server.edu.https: Flags [P.], seq 598:644, ack 6646, win 501, options [nop,nop,TS val 2034387783 ecr 316950709], length 46
09:37:25.074711 IP me.38144 > server.edu.https: Flags [P.], seq 644:693, ack 6646, win 501, options [nop,nop,TS val 2034387783 ecr 316950709], length 49
09:37:25.074722 IP me.38144 > server.edu.https: Flags [P.], seq 693:728, ack 6646, win 501, options [nop,nop,TS val 2034387783 ecr 316950709], length 35
09:37:25.074787 IP me.38144 > server.edu.https: Flags [P.], seq 728:936, ack 6646, win 501, options [nop,nop,TS val 2034387783 ecr 316950709], length 208
09:37:25.090024 IP server.edu.https > me.38144: Flags [.], ack 644, win 59, options [nop,nop,TS val 316950726 ecr 2034387783], length 0
09:37:25.090213 IP server.edu.https > me.38144: Flags [.], ack 728, win 59, options [nop,nop,TS val 316950726 ecr 2034387783], length 0
09:37:25.103732 IP server.edu.https > me.38144: Flags [P.], seq 6646:6949, ack 936, win 61, options [nop,nop,TS val 316950740 ecr 2034387783], length 303
09:37:25.103750 IP me.38144 > server.edu.https: Flags [.], ack 6949, win 501, options [nop,nop,TS val 2034387812 ecr 316950740], length 0
09:37:25.103799 IP server.edu.https > me.38144: Flags [P.], seq 6949:7252, ack 936, win 61, options [nop,nop,TS val 316950740 ecr 2034387783], length 303
09:37:25.103806 IP me.38144 > server.edu.https: Flags [.], ack 7252, win 501, options [nop,nop,TS val 2034387812 ecr 316950740], length 0
09:37:25.104017 IP server.edu.https > me.38144: Flags [P.], seq 7252:7311, ack 936, win 61, options [nop,nop,TS val 316950740 ecr 2034387783], length 59
09:37:25.104023 IP me.38144 > server.edu.https: Flags [.], ack 7311, win 501, options [nop,nop,TS val 2034387813 ecr 316950740], length 0
09:37:25.104099 IP me.38144 > server.edu.https: Flags [P.], seq 936:967, ack 7311, win 501, options [nop,nop,TS val 2034387813 ecr 316950740], length 31
09:37:25.172986 IP server.edu.https > me.38144: Flags [.], ack 967, win 61, options [nop,nop,TS val 316950809 ecr 2034387813], length 0
09:37:35.181348 IP me.38144 > server.edu.https: Flags [.], ack 7311, win 501, options [nop,nop,TS val 2034397890 ecr 316950809], length 0
09:37:35.194665 IP server.edu.https > me.38144: Flags [.], ack 967, win 61, options [nop,nop,TS val 316960830 ecr 2034387813], length 0
09:37:45.421017 IP me.38144 > server.edu.https: Flags [.], ack 7311, win 501, options [nop,nop,TS val 2034408130 ecr 316960830], length 0
09:37:45.431187 IP server.edu.https > me.38144: Flags [.], ack 967, win 61, options [nop,nop,TS val 316971067 ecr 2034387813], length 0
09:37:55.661340 IP me.38144 > server.edu.https: Flags [.], ack 7311, win 501, options [nop,nop,TS val 2034418370 ecr 316971067], length 0
09:37:55.676692 IP server.edu.https > me.38144: Flags [.], ack 967, win 61, options [nop,nop,TS val 316981312 ecr 2034387813], length 0
09:38:05.901330 IP me.38144 > server.edu.https: Flags [.], ack 7311, win 501, options [nop,nop,TS val 2034428610 ecr 316981312], length 0
09:38:05.914324 IP server.edu.https > me.38144: Flags [.], ack 967, win 61, options [nop,nop,TS val 316991550 ecr 2034387813], length 0
09:38:16.144985 IP me.38144 > server.edu.https: Flags [.], ack 7311, win 501, options [nop,nop,TS val 2034438854 ecr 316991550], length 0
09:38:16.159307 IP server.edu.https > me.38144: Flags [.], ack 967, win 61, options [nop,nop,TS val 317001795 ecr 2034387813], length 0
09:38:25.134042 IP server.edu.https > me.38144: Flags [F.], seq 7311, ack 967, win 61, options [nop,nop,TS val 317010770 ecr 2034387813], length 0
09:38:25.134405 IP me.38144 > server.edu.https: Flags [P.], seq 967:991, ack 7312, win 501, options [nop,nop,TS val 2034447843 ecr 317010770], length 24
09:38:25.135478 IP me.38144 > server.edu.https: Flags [F.], seq 991, ack 7312, win 501, options [nop,nop,TS val 2034447844 ecr 317010770], length 0
09:38:25.156448 IP server.edu.https > me.38144: Flags [R], seq 3051809970, win 0, length 0
09:38:25.156489 IP server.edu.https > me.38144: Flags [R], seq 3051809970, win 0, length 0
```
The server closes the connection because of some reasons.
The newsboat connection without VPN works perfect and waits for longer than 60 seconds. The changes from you @dennisschagt aren't even necessary. I tried it with the most recent snap version on another device (without vpn) and it works flawlessly:
```
sudo tcpdump -i wlp3s0 host server.edu
tcpdump: verbose output suppressed, use -v or -vv for full protocol decode
listening on wlp3s0, link-type EN10MB (Ethernet), capture size 262144 bytes
09:25:21.525548 IP6 me.55688 > server.edu.https: Flags [S], seq 1292142244, win 64800, options [mss 1440,sackOK,TS val 1633731199 ecr 0,nop,wscale 7], length 0
09:25:21.554136 IP6 server.edu.https > me.55688: Flags [S.], seq 2040696751, ack 1292142245, win 64260, options [mss 1380,sackOK,TS val 932080636 ecr 1633731199,nop,wscale 7], length 0
09:25:21.554208 IP6 me.55688 > server.edu.https: Flags [.], ack 1, win 507, options [nop,nop,TS val 1633731228 ecr 932080636], length 0
09:25:21.618775 IP6 me.55688 > server.edu.https: Flags [P.], seq 1:518, ack 1, win 507, options [nop,nop,TS val 1633731292 ecr 932080636], length 517
09:25:21.647709 IP6 server.edu.https > me.55688: Flags [.], ack 518, win 501, options [nop,nop,TS val 932080727 ecr 1633731292], length 0
09:25:21.647735 IP6 server.edu.https > me.55688: Flags [P.], seq 1:4097, ack 518, win 501, options [nop,nop,TS val 932080728 ecr 1633731292], length 4096
09:25:21.647736 IP6 server.edu.https > me.55688: Flags [P.], seq 4097:6652, ack 518, win 501, options [nop,nop,TS val 932080729 ecr 1633731292], length 2555
09:25:21.647758 IP6 me.55688 > server.edu.https: Flags [.], ack 4097, win 484, options [nop,nop,TS val 1633731321 ecr 932080728], length 0
09:25:21.647770 IP6 me.55688 > server.edu.https: Flags [.], ack 6652, win 465, options [nop,nop,TS val 1633731321 ecr 932080729], length 0
09:25:21.651823 IP6 me.55688 > server.edu.https: Flags [P.], seq 518:598, ack 6652, win 501, options [nop,nop,TS val 1633731325 ecr 932080729], length 80
09:25:21.651952 IP6 me.55688 > server.edu.https: Flags [P.], seq 598:915, ack 6652, win 501, options [nop,nop,TS val 1633731326 ecr 932080729], length 317
09:25:21.689191 IP6 server.edu.https > me.55688: Flags [.], ack 915, win 501, options [nop,nop,TS val 932080771 ecr 1633731325], length 0
09:25:21.689197 IP6 server.edu.https > me.55688: Flags [P.], seq 6652:6971, ack 915, win 501, options [nop,nop,TS val 932080771 ecr 1633731325], length 319
09:25:21.689197 IP6 server.edu.https > me.55688: Flags [P.], seq 6971:7290, ack 915, win 501, options [nop,nop,TS val 932080771 ecr 1633731325], length 319
09:25:21.689214 IP6 me.55688 > server.edu.https: Flags [.], ack 6971, win 501, options [nop,nop,TS val 1633731363 ecr 932080771], length 0
09:25:21.689228 IP6 me.55688 > server.edu.https: Flags [.], ack 7290, win 501, options [nop,nop,TS val 1633731363 ecr 932080771], length 0
09:26:46.748820 IP6 server.edu.https > me.55688: Flags [P.], seq 7290:15754, ack 915, win 501, options [nop,nop,TS val 932165748 ecr 1633731363], length 8464
09:26:46.748853 IP6 server.edu.https > me.55688: Flags [.], seq 15754:19858, ack 915, win 501, options [nop,nop,TS val 932165748 ecr 1633731363], length 4104
09:26:46.748938 IP6 me.55688 > server.edu.https: Flags [.], ack 15754, win 447, options [nop,nop,TS val 1633816423 ecr 932165748], length 0
09:26:46.749021 IP6 me.55688 > server.edu.https: Flags [.], ack 19858, win 419, options [nop,nop,TS val 1633816423 ecr 932165748], length 0
09:26:46.773704 IP6 server.edu.https > me.55688: Flags [.], seq 19858:21226, ack 915, win 501, options [nop,nop,TS val 932165851 ecr 1633816423], length 1368
09:26:46.773728 IP6 me.55688 > server.edu.https: Flags [.], ack 21226, win 501, options [nop,nop,TS val 1633816447 ecr 932165851], length 0
09:26:46.775771 IP6 server.edu.https > me.55688: Flags [.], seq 21226:25330, ack 915, win 501, options [nop,nop,TS val 932165851 ecr 1633816423], length 4104
09:26:46.775785 IP6 server.edu.https > me.55688: Flags [.], seq 25330:39010, ack 915, win 501, options [nop,nop,TS val 932165852 ecr 1633816423], length 13680
09:26:46.775802 IP6 me.55688 > server.edu.https: Flags [.], ack 25330, win 484, options [nop,nop,TS val 1633816449 ecr 932165851], length 0
09:26:46.775843 IP6 me.55688 > server.edu.https: Flags [.], ack 39010, win 391, options [nop,nop,TS val 1633816450 ecr 932165852], length 0
09:26:46.777667 IP6 server.edu.https > me.55688: Flags [.], seq 39010:47218, ack 915, win 501, options [nop,nop,TS val 932165852 ecr 1633816423], length 8208
09:26:46.777693 IP6 me.55688 > server.edu.https: Flags [.], ack 47218, win 456, options [nop,nop,TS val 1633816451 ecr 932165852], length 0
09:26:46.793067 IP6 server.edu.https > me.55688: Flags [.], seq 47218:48586, ack 915, win 501, options [nop,nop,TS val 932165872 ecr 1633816447], length 1368
09:26:46.793086 IP6 me.55688 > server.edu.https: Flags [.], ack 48586, win 501, options [nop,nop,TS val 1633816467 ecr 932165872], length 0
09:26:46.793243 IP6 server.edu.https > me.55688: Flags [.], seq 48586:49954, ack 915, win 501, options [nop,nop,TS val 932165872 ecr 1633816447], length 1368
09:26:46.793257 IP6 me.55688 > server.edu.https: Flags [.], ack 49954, win 493, options [nop,nop,TS val 1633816467 ecr 932165872], length 0
09:26:46.801937 IP6 server.edu.https > me.55688: Flags [.], seq 49954:51322, ack 915, win 501, options [nop,nop,TS val 932165881 ecr 1633816450], length 1368
09:26:46.801956 IP6 me.55688 > server.edu.https: Flags [.], ack 51322, win 501, options [nop,nop,TS val 1633816476 ecr 932165881], length 0
09:26:46.803390 IP6 server.edu.https > me.55688: Flags [.], seq 51322:55426, ack 915, win 501, options [nop,nop,TS val 932165881 ecr 1633816450], length 4104
09:26:46.803397 IP6 server.edu.https > me.55688: Flags [.], seq 55426:62266, ack 915, win 501, options [nop,nop,TS val 932165881 ecr 1633816451], length 6840
09:26:46.803406 IP6 me.55688 > server.edu.https: Flags [.], ack 55426, win 484, options [nop,nop,TS val 1633816477 ecr 932165881], length 0
09:26:46.803419 IP6 me.55688 > server.edu.https: Flags [.], ack 62266, win 437, options [nop,nop,TS val 1633816477 ecr 932165881], length 0
09:26:46.805696 IP6 server.edu.https > me.55688: Flags [.], seq 62266:80050, ack 915, win 501, options [nop,nop,TS val 932165881 ecr 1633816451], length 17784
09:26:46.805720 IP6 me.55688 > server.edu.https: Flags [.], ack 80050, win 391, options [nop,nop,TS val 1633816479 ecr 932165881], length 0
09:26:46.809363 IP6 server.edu.https > me.55688: Flags [P.], seq 80050:87008, ack 915, win 501, options [nop,nop,TS val 932165881 ecr 1633816451], length 6958
09:26:46.809384 IP6 me.55688 > server.edu.https: Flags [.], ack 87008, win 456, options [nop,nop,TS val 1633816483 ecr 932165881], length 0
09:26:46.810070 IP6 me.55688 > server.edu.https: Flags [P.], seq 915:939, ack 87008, win 501, options [nop,nop,TS val 1633816484 ecr 932165881], length 24
09:26:46.811490 IP6 me.55688 > server.edu.https: Flags [F.], seq 939, ack 87008, win 501, options [nop,nop,TS val 1633816485 ecr 932165881], length 0
09:26:46.830232 IP6 server.edu.https > me.55688: Flags [P.], seq 87008:87032, ack 940, win 501, options [nop,nop,TS val 932165910 ecr 1633816484], length 24
09:26:46.830287 IP6 me.55688 > server.edu.https: Flags [R], seq 1292143184, win 0, length 0
09:26:46.831600 IP6 server.edu.https > me.55688: Flags [F.], seq 87032, ack 940, win 501, options [nop,nop,TS val 932165910 ecr 1633816484], length 0
09:26:46.831657 IP6 me.55688 > server.edu.https: Flags [R], seq 1292143184, win 0, length 0
```
In the end I don't know why this happens or if it's maybe the fault of this program or not. It's not really a special VPN Server but the standard connection from NordVPN. And the browser connection worked fine and a few days ago when the response time wasn't that high the other feed readers had also no problem with it. Now they timeout after 10 or 30 seconds.

**Comment by Minoru** [comment]
Thanks for the logs! Clearly, the server can somehow tell Newsboat and Firefox apart.

Did you try the `always-download` setting I suggested? What if you combine it with `user-agent`, to make Newsboat look even more like a browser?

I think the only remaining thing that could identify Newsboat are cookies. @plsdosomething, can you please try downloading the feed using Private mode in Firefox? Open a new Private window and paste the RSS URL in there — *do not* go through the website in search of the RSS link. That will ensure you don't have any cookies from that site.

> And the browser connection worked fine and a few days ago when the response time wasn't that high the other feed readers had also no problem with it. Now they timeout after 10 or 30 seconds.

You should really tell the site admins about that. Email webmaster@server.edu. If they don't have monitoring set up, they might not even be aware of the problem.

**Comment by dennisschagt** [comment]
From your logs, the only noteworthy thing I could find:
```
09:34:43.219002: Start of connection
...
09:34:45.638756: Data transfer
...
09:35:42.531792 IP me.38120 > server.edu.https: Flags [P.], seq 1286:1325, ack 7435, win 501, options [nop,nop,TS val 2034285240 ecr 316791288], length 39
09:35:42.545731 IP server.edu.https > me.38120: Flags [.], ack 1325, win 65, options [nop,nop,TS val 316848182 ecr 2034285240], length 0
09:35:42.635397 IP server.edu.https > me.38120: Flags [P.], seq 7435:7474, ack 1325, win 65, options [nop,nop,TS val 316848272 ecr 2034285240], length 39
09:35:42.635428 IP me.38120 > server.edu.https: Flags [.], ack 7474, win 501, options [nop,nop,TS val 2034285344 ecr 316848272], length 0
```

It looks like Firefox (with VPN active) sends some data 59 seconds after setting up the connection (57 seconds after previous data packet).
Some of my thoughts:
- It might be the VPN server which closes the connection if there is no data packet in the last 60 seconds.
- Maybe the browser has a proxy configured (maybe configured by the VPN software)

Could you check if Firefox also sends data ~57 seconds after the latest data transfer if it connects without the VPN?

Just to be clear, I'm mostly guessing at the issue so feel free to ignore any of my requests.

**Comment by plsdosomething** [comment]
@Minoru I now have tried the always-download option (alone and together with the user-agent option) and unfortunately it doesn't change anything as far as I can notice.
I tried to look for a difference between a connection with the normal browser window and a private window and couldn't find one. In the connection establishment from the normal window more packages were transferred but the result was the same with both. The URL isn't exactly a link to a file but to a php website (together with some user id's) and this website generates the xml file. And it's protected by a username and password. (I used the complete URL with username and password for the always-download option).
Overall the whole website is really slow because of all the online classes and the videos that are being streamed/uploaded. Idk if that's possible, but maybe they have limited the resources that one account can use in an attempt to allow access to everyone. They already had maintenance downtime last week and plan to do it again in a few days so I think they know there are problems. 

@dennisschagt 
The VPN Software is the one that is already installed in Ubuntu (I only need to select an openvpn configuration file from the menu and enter the login details) So I'd doubt it does anything with the browser. The data that is sent just before one minute ends is also sent without a vpn connection. The time varies from 55 to 59 seconds but is always before one minute. I tried to capture the same thing with wireshark to find out what is send, but it doesn't contain readable information and only says "Application Data":
![Untitled](https://user-images.githubusercontent.com/69011406/99440046-4b0b8e80-2916-11eb-9b14-3be420958d65.png)
(orange is the server IP and blue is mine)
The delay of 2 seconds between package 30 and 31 is because there is a browser pop up that wants that I confirm the login. The 4 following ones are the data the browser sends just before one minute ends. I couldn't find out why it does that.
It's all really strange and random sometimes. (For example sometimes in the browser the server sends the FIN Package first and sometimes the client does it. It changes every few hours. This morning it was the client, during lunch time the server and now again the client. ... And looking at the latest log (the one at the bottom) it "changed" again and the server did send the FIN package first.
And why these packages are sent is also strange and random for me. The following was the first time I tried it without VPN this morning (on my second device) and at that time it did not send the message after 59 seconds. It kind of looks like the tcp keep alive connection newsboat did after your code changes. But this was on the laptop and the newsboat version there was the latest snap version so i don't think that I mixed them up.:
```
sudo tcpdump -i wlp3s0 host server.edu
tcpdump: verbose output suppressed, use -v or -vv for full protocol decode
listening on wlp3s0, link-type EN10MB (Ethernet), capture size 262144 bytes
09:19:05.262542 IP6 me.55650 > server.edu.https: Flags [S], seq 1577124097, win 64800, options [mss 1440,sackOK,TS val 1633354936 ecr 0,nop,wscale 7], length 0
09:19:05.294634 IP6 server.edu.https > me.55650: Flags [S.], seq 1095581309, ack 1577124098, win 64260, options [mss 1380,sackOK,TS val 931704385 ecr 1633354936,nop,wscale 7], length 0
09:19:05.294653 IP6 me.55650 > server.edu.https: Flags [.], ack 1, win 507, options [nop,nop,TS val 1633354968 ecr 931704385], length 0
09:19:05.296615 IP6 me.55650 > server.edu.https: Flags [P.], seq 1:518, ack 1, win 507, options [nop,nop,TS val 1633354970 ecr 931704385], length 517
09:19:05.340018 IP6 server.edu.https > me.55650: Flags [.], ack 518, win 501, options [nop,nop,TS val 931704430 ecr 1633354970], length 0
09:19:05.345505 IP6 server.edu.https > me.55650: Flags [P.], seq 1:4097, ack 518, win 501, options [nop,nop,TS val 931704430 ecr 1633354970], length 4096
09:19:05.345527 IP6 server.edu.https > me.55650: Flags [P.], seq 4097:6636, ack 518, win 501, options [nop,nop,TS val 931704431 ecr 1633354970], length 2539
09:19:05.345570 IP6 me.55650 > server.edu.https: Flags [.], ack 4097, win 484, options [nop,nop,TS val 1633355019 ecr 931704430], length 0
09:19:05.345613 IP6 me.55650 > server.edu.https: Flags [.], ack 6636, win 465, options [nop,nop,TS val 1633355019 ecr 931704431], length 0
09:19:05.452713 IP6 me.55650 > server.edu.https: Flags [P.], seq 518:582, ack 6636, win 501, options [nop,nop,TS val 1633355126 ecr 931704431], length 64
09:19:05.452863 IP6 me.55650 > server.edu.https: Flags [P.], seq 582:1053, ack 6636, win 501, options [nop,nop,TS val 1633355127 ecr 931704431], length 471
09:19:05.488394 IP6 server.edu.https > me.55650: Flags [.], ack 1053, win 501, options [nop,nop,TS val 931704580 ecr 1633355126], length 0
09:19:05.489254 IP6 server.edu.https > me.55650: Flags [P.], seq 6636:6939, ack 1053, win 501, options [nop,nop,TS val 931704580 ecr 1633355126], length 303
09:19:05.489266 IP6 server.edu.https > me.55650: Flags [P.], seq 6939:7242, ack 1053, win 501, options [nop,nop,TS val 931704580 ecr 1633355126], length 303
09:19:05.489284 IP6 me.55650 > server.edu.https: Flags [.], ack 6939, win 501, options [nop,nop,TS val 1633355163 ecr 931704580], length 0
09:19:05.489307 IP6 me.55650 > server.edu.https: Flags [.], ack 7242, win 501, options [nop,nop,TS val 1633355163 ecr 931704580], length 0
09:19:05.570703 IP6 server.edu.https > me.55650: Flags [P.], seq 7242:7618, ack 1053, win 501, options [nop,nop,TS val 931704662 ecr 1633355163], length 376
09:19:05.570737 IP6 me.55650 > server.edu.https: Flags [.], ack 7618, win 501, options [nop,nop,TS val 1633355244 ecr 931704662], length 0
09:19:09.107329 IP6 me.55650 > server.edu.https: Flags [P.], seq 1053:1599, ack 7618, win 501, options [nop,nop,TS val 1633358781 ecr 931704662], length 546
09:19:09.187110 IP6 server.edu.https > me.55650: Flags [.], ack 1599, win 501, options [nop,nop,TS val 931708276 ecr 1633358781], length 0
09:19:19.288034 IP6 me.55650 > server.edu.https: Flags [.], ack 7618, win 501, options [nop,nop,TS val 1633368962 ecr 931708276], length 0
09:19:19.323790 IP6 server.edu.https > me.55650: Flags [.], ack 1599, win 501, options [nop,nop,TS val 931718413 ecr 1633358781], length 0
09:19:29.527862 IP6 me.55650 > server.edu.https: Flags [.], ack 7618, win 501, options [nop,nop,TS val 1633379202 ecr 931718413], length 0
09:19:29.564701 IP6 server.edu.https > me.55650: Flags [.], ack 1599, win 501, options [nop,nop,TS val 931728654 ecr 1633358781], length 0
09:19:39.767986 IP6 me.55650 > server.edu.https: Flags [.], ack 7618, win 501, options [nop,nop,TS val 1633389442 ecr 931728654], length 0
09:19:39.803950 IP6 server.edu.https > me.55650: Flags [.], ack 1599, win 501, options [nop,nop,TS val 931738891 ecr 1633358781], length 0
09:19:50.008035 IP6 me.55650 > server.edu.https: Flags [.], ack 7618, win 501, options [nop,nop,TS val 1633399682 ecr 931738891], length 0
09:19:50.042415 IP6 server.edu.https > me.55650: Flags [.], ack 1599, win 501, options [nop,nop,TS val 931749131 ecr 1633358781], length 0
09:20:00.247907 IP6 me.55650 > server.edu.https: Flags [.], ack 7618, win 501, options [nop,nop,TS val 1633409922 ecr 931749131], length 0
09:20:00.291106 IP6 server.edu.https > me.55650: Flags [.], ack 1599, win 501, options [nop,nop,TS val 931759379 ecr 1633358781], length 0
09:20:10.487893 IP6 me.55650 > server.edu.https: Flags [.], ack 7618, win 501, options [nop,nop,TS val 1633420162 ecr 931759379], length 0
09:20:10.516128 IP6 server.edu.https > me.55650: Flags [.], ack 1599, win 501, options [nop,nop,TS val 931769603 ecr 1633358781], length 0
09:20:36.097977 IP6 server.edu.https > me.55650: Flags [.], seq 7618:21298, ack 1599, win 501, options [nop,nop,TS val 931795149 ecr 1633358781], length 13680
09:20:36.098046 IP6 me.55650 > server.edu.https: Flags [.], ack 21298, win 419, options [nop,nop,TS val 1633445772 ecr 931795149], length 0
09:20:36.144794 IP6 server.edu.https > me.55650: Flags [.], seq 21298:24034, ack 1599, win 501, options [nop,nop,TS val 931795231 ecr 1633445772], length 2736
09:20:36.144865 IP6 me.55650 > server.edu.https: Flags [.], ack 24034, win 493, options [nop,nop,TS val 1633445819 ecr 931795231], length 0
09:20:36.149651 IP6 server.edu.https > me.55650: Flags [.], seq 24034:40450, ack 1599, win 501, options [nop,nop,TS val 931795231 ecr 1633445772], length 16416
09:20:36.149678 IP6 server.edu.https > me.55650: Flags [.], seq 40450:44554, ack 1599, win 501, options [nop,nop,TS val 931795232 ecr 1633445772], length 4104
09:20:36.149728 IP6 me.55650 > server.edu.https: Flags [.], ack 40450, win 758, options [nop,nop,TS val 1633445823 ecr 931795231], length 0
09:20:36.149775 IP6 me.55650 > server.edu.https: Flags [.], ack 44554, win 822, options [nop,nop,TS val 1633445823 ecr 931795232], length 0
09:20:36.149908 IP6 server.edu.https > me.55650: Flags [.], seq 44554:48658, ack 1599, win 501, options [nop,nop,TS val 931795232 ecr 1633445772], length 4104
09:20:36.149923 IP6 me.55650 > server.edu.https: Flags [.], ack 48658, win 886, options [nop,nop,TS val 1633445824 ecr 931795232], length 0
09:20:36.194564 IP6 server.edu.https > me.55650: Flags [.], seq 48658:50026, ack 1599, win 501, options [nop,nop,TS val 931795282 ecr 1633445819], length 1368
09:20:36.194598 IP6 me.55650 > server.edu.https: Flags [.], ack 50026, win 908, options [nop,nop,TS val 1633445868 ecr 931795282], length 0
09:20:36.196261 IP6 server.edu.https > me.55650: Flags [.], seq 50026:54130, ack 1599, win 501, options [nop,nop,TS val 931795282 ecr 1633445819], length 4104
09:20:36.196273 IP6 server.edu.https > me.55650: Flags [.], seq 54130:56866, ack 1599, win 501, options [nop,nop,TS val 931795282 ecr 1633445823], length 2736
09:20:36.196275 IP6 server.edu.https > me.55650: Flags [.], seq 56866:62338, ack 1599, win 501, options [nop,nop,TS val 931795282 ecr 1633445824], length 5472
09:20:36.196276 IP6 server.edu.https > me.55650: Flags [.], seq 62338:65074, ack 1599, win 501, options [nop,nop,TS val 931795283 ecr 1633445824], length 2736
09:20:36.196295 IP6 me.55650 > server.edu.https: Flags [.], ack 54130, win 973, options [nop,nop,TS val 1633445870 ecr 931795282], length 0
09:20:36.196322 IP6 me.55650 > server.edu.https: Flags [.], ack 56866, win 1015, options [nop,nop,TS val 1633445870 ecr 931795282], length 0
09:20:36.196331 IP6 me.55650 > server.edu.https: Flags [.], ack 62338, win 1101, options [nop,nop,TS val 1633445870 ecr 931795282], length 0
09:20:36.196339 IP6 me.55650 > server.edu.https: Flags [.], ack 65074, win 1144, options [nop,nop,TS val 1633445870 ecr 931795283], length 0
09:20:36.198911 IP6 server.edu.https > me.55650: Flags [.], seq 65074:85594, ack 1599, win 501, options [nop,nop,TS val 931795283 ecr 1633445824], length 20520
09:20:36.198945 IP6 me.55650 > server.edu.https: Flags [.], ack 85594, win 1215, options [nop,nop,TS val 1633445873 ecr 931795283], length 0
09:20:36.199122 IP6 server.edu.https > me.55650: Flags [P.], seq 85594:87357, ack 1599, win 501, options [nop,nop,TS val 931795283 ecr 1633445824], length 1763
09:20:36.199141 IP6 me.55650 > server.edu.https: Flags [.], ack 87357, win 1202, options [nop,nop,TS val 1633445873 ecr 931795283], length 0
09:20:36.965663 IP6 me.55650 > server.edu.https: Flags [P.], seq 1599:2107, ack 87357, win 1215, options [nop,nop,TS val 1633446639 ecr 931795283], length 508
09:20:36.966167 IP6 me.55650 > server.edu.https: Flags [FP.], seq 2107:2131, ack 87357, win 1215, options [nop,nop,TS val 1633446640 ecr 931795283], length 24
09:20:37.014701 IP6 server.edu.https > me.55650: Flags [.], ack 2107, win 501, options [nop,nop,TS val 931796102 ecr 1633446639], length 0
09:20:37.017517 IP6 server.edu.https > me.55650: Flags [.], seq 87357:88725, ack 2132, win 501, options [nop,nop,TS val 931796105 ecr 1633446640], length 1368
09:20:37.017543 IP6 me.55650 > server.edu.https: Flags [R], seq 1577126229, win 0, length 0
09:20:37.017671 IP6 server.edu.https > me.55650: Flags [P.], seq 88725:89156, ack 2132, win 501, options [nop,nop,TS val 931796105 ecr 1633446640], length 431
09:20:37.017682 IP6 me.55650 > server.edu.https: Flags [R], seq 1577126229, win 0, length 0
09:20:37.018449 IP6 server.edu.https > me.55650: Flags [FP.], seq 89156:89180, ack 2132, win 501, options [nop,nop,TS val 931796105 ecr 1633446640], length 24
09:20:37.018457 IP6 me.55650 > server.edu.https: Flags [R], seq 1577126229, win 0, length 0
```
Now on the other hand it does send the messages just before a minute (I also checked if maybe a private window changes something, but that's not the case): 
```
sudo tcpdump -i wlp3s0 host server.edu
[sudo] password for undefined: 
tcpdump: verbose output suppressed, use -v or -vv for full protocol decode
listening on wlp3s0, link-type EN10MB (Ethernet), capture size 262144 bytes
21:03:56.423015 IP6 me.33906 > server.edu.https: Flags [S], seq 1244995285, win 64800, options [mss 1440,sackOK,TS val 2950786599 ecr 0,nop,wscale 7], length 0
21:03:56.446695 IP6 server.edu.https > me.33906: Flags [S.], seq 333391902, ack 1244995286, win 64260, options [mss 1380,sackOK,TS val 178306680 ecr 2950786599,nop,wscale 7], length 0
21:03:56.446712 IP6 me.33906 > server.edu.https: Flags [.], ack 1, win 507, options [nop,nop,TS val 2950786623 ecr 178306680], length 0
21:03:56.448782 IP6 me.33906 > server.edu.https: Flags [P.], seq 1:518, ack 1, win 507, options [nop,nop,TS val 2950786625 ecr 178306680], length 517
21:03:56.487653 IP6 server.edu.https > me.33906: Flags [.], ack 518, win 501, options [nop,nop,TS val 178306721 ecr 2950786625], length 0
21:03:56.488785 IP6 server.edu.https > me.33906: Flags [.], seq 1:1369, ack 518, win 501, options [nop,nop,TS val 178306721 ecr 2950786625], length 1368
21:03:56.488821 IP6 me.33906 > server.edu.https: Flags [.], ack 1369, win 501, options [nop,nop,TS val 2950786665 ecr 178306721], length 0
21:03:56.489005 IP6 server.edu.https > me.33906: Flags [.], seq 1369:2737, ack 518, win 501, options [nop,nop,TS val 178306721 ecr 2950786625], length 1368
21:03:56.489025 IP6 me.33906 > server.edu.https: Flags [.], ack 2737, win 493, options [nop,nop,TS val 2950786665 ecr 178306721], length 0
21:03:56.489836 IP6 server.edu.https > me.33906: Flags [P.], seq 2737:4097, ack 518, win 501, options [nop,nop,TS val 178306721 ecr 2950786625], length 1360
21:03:56.489863 IP6 me.33906 > server.edu.https: Flags [.], ack 4097, win 484, options [nop,nop,TS val 2950786666 ecr 178306721], length 0
21:03:56.490441 IP6 server.edu.https > me.33906: Flags [P.], seq 4097:6630, ack 518, win 501, options [nop,nop,TS val 178306722 ecr 2950786625], length 2533
21:03:56.490471 IP6 me.33906 > server.edu.https: Flags [.], ack 6630, win 465, options [nop,nop,TS val 2950786666 ecr 178306722], length 0
21:03:56.601276 IP6 me.33906 > server.edu.https: Flags [P.], seq 518:582, ack 6630, win 501, options [nop,nop,TS val 2950786777 ecr 178306722], length 64
21:03:56.601526 IP6 me.33906 > server.edu.https: Flags [P.], seq 582:752, ack 6630, win 501, options [nop,nop,TS val 2950786777 ecr 178306722], length 170
21:03:56.604134 IP6 me.33906 > server.edu.https: Flags [P.], seq 752:1080, ack 6630, win 501, options [nop,nop,TS val 2950786780 ecr 178306722], length 328
21:03:56.625912 IP6 server.edu.https > me.33906: Flags [.], ack 1080, win 501, options [nop,nop,TS val 178306860 ecr 2950786777], length 0
21:03:56.626327 IP6 server.edu.https > me.33906: Flags [P.], seq 6630:6917, ack 1080, win 501, options [nop,nop,TS val 178306860 ecr 2950786777], length 287
21:03:56.626348 IP6 server.edu.https > me.33906: Flags [P.], seq 6917:7204, ack 1080, win 501, options [nop,nop,TS val 178306861 ecr 2950786777], length 287
21:03:56.626351 IP6 server.edu.https > me.33906: Flags [P.], seq 7204:7263, ack 1080, win 501, options [nop,nop,TS val 178306861 ecr 2950786777], length 59
21:03:56.626385 IP6 me.33906 > server.edu.https: Flags [.], ack 6917, win 501, options [nop,nop,TS val 2950786802 ecr 178306860], length 0
21:03:56.626447 IP6 me.33906 > server.edu.https: Flags [.], ack 7204, win 501, options [nop,nop,TS val 2950786802 ecr 178306861], length 0
21:03:56.626475 IP6 me.33906 > server.edu.https: Flags [.], ack 7263, win 501, options [nop,nop,TS val 2950786802 ecr 178306861], length 0
21:03:56.627600 IP6 me.33906 > server.edu.https: Flags [P.], seq 1080:1111, ack 7263, win 501, options [nop,nop,TS val 2950786803 ecr 178306861], length 31
21:03:56.690802 IP6 server.edu.https > me.33906: Flags [P.], seq 7263:7435, ack 1111, win 501, options [nop,nop,TS val 178306925 ecr 2950786803], length 172
21:03:56.690915 IP6 me.33906 > server.edu.https: Flags [.], ack 7435, win 501, options [nop,nop,TS val 2950786867 ecr 178306925], length 0
21:03:58.883533 IP6 me.33906 > server.edu.https: Flags [P.], seq 1111:1286, ack 7435, win 501, options [nop,nop,TS val 2950789059 ecr 178306925], length 175
21:03:58.952322 IP6 server.edu.https > me.33906: Flags [.], ack 1286, win 501, options [nop,nop,TS val 178309172 ecr 2950789059], length 0
21:04:55.524315 IP6 me.33906 > server.edu.https: Flags [P.], seq 1286:1325, ack 7435, win 501, options [nop,nop,TS val 2950845700 ecr 178309172], length 39
21:04:55.546966 IP6 server.edu.https > me.33906: Flags [.], ack 1325, win 501, options [nop,nop,TS val 178365713 ecr 2950845700], length 0
21:04:55.772926 IP6 server.edu.https > me.33906: Flags [P.], seq 7435:7474, ack 1325, win 501, options [nop,nop,TS val 178365886 ecr 2950845700], length 39
21:04:55.773019 IP6 me.33906 > server.edu.https: Flags [.], ack 7474, win 501, options [nop,nop,TS val 2950845949 ecr 178365886], length 0
21:05:18.206060 IP6 server.edu.https > me.33906: Flags [P.], seq 7474:7572, ack 1325, win 501, options [nop,nop,TS val 178388269 ecr 2950845949], length 98
21:05:18.206088 IP6 server.edu.https > me.33906: Flags [P.], seq 7572:12860, ack 1325, win 501, options [nop,nop,TS val 178388269 ecr 2950845949], length 5288
21:05:18.206092 IP6 server.edu.https > me.33906: Flags [P.], seq 12860:18148, ack 1325, win 501, options [nop,nop,TS val 178388269 ecr 2950845949], length 5288
21:05:18.206095 IP6 server.edu.https > me.33906: Flags [.], seq 18148:19516, ack 1325, win 501, options [nop,nop,TS val 178388269 ecr 2950845949], length 1368
21:05:18.206133 IP6 me.33906 > server.edu.https: Flags [.], ack 7572, win 501, options [nop,nop,TS val 2950868382 ecr 178388269], length 0
21:05:18.206189 IP6 me.33906 > server.edu.https: Flags [.], ack 12860, win 465, options [nop,nop,TS val 2950868382 ecr 178388269], length 0
21:05:18.206205 IP6 me.33906 > server.edu.https: Flags [.], ack 18148, win 428, options [nop,nop,TS val 2950868382 ecr 178388269], length 0
21:05:18.206220 IP6 me.33906 > server.edu.https: Flags [.], ack 19516, win 419, options [nop,nop,TS val 2950868382 ecr 178388269], length 0
21:05:18.214284 IP6 server.edu.https > me.33906: Flags [.], seq 19516:20884, ack 1325, win 501, options [nop,nop,TS val 178388373 ecr 2950845949], length 1368
21:05:18.214342 IP6 me.33906 > server.edu.https: Flags [.], ack 20884, win 501, options [nop,nop,TS val 2950868390 ecr 178388373], length 0
21:05:18.225731 IP6 server.edu.https > me.33906: Flags [.], seq 20884:22252, ack 1325, win 501, options [nop,nop,TS val 178388386 ecr 2950868382], length 1368
21:05:18.225792 IP6 me.33906 > server.edu.https: Flags [.], ack 22252, win 501, options [nop,nop,TS val 2950868402 ecr 178388386], length 0
21:05:18.238207 IP6 server.edu.https > me.33906: Flags [.], seq 22252:27724, ack 1325, win 501, options [nop,nop,TS val 178388396 ecr 2950868382], length 5472
21:05:18.238238 IP6 server.edu.https > me.33906: Flags [.], seq 27724:40036, ack 1325, win 501, options [nop,nop,TS val 178388396 ecr 2950868390], length 12312
21:05:18.238284 IP6 me.33906 > server.edu.https: Flags [.], ack 27724, win 587, options [nop,nop,TS val 2950868414 ecr 178388396], length 0
21:05:18.238365 IP6 me.33906 > server.edu.https: Flags [.], ack 40036, win 779, options [nop,nop,TS val 2950868414 ecr 178388396], length 0
21:05:18.239705 IP6 server.edu.https > me.33906: Flags [.], seq 40036:49612, ack 1325, win 501, options [nop,nop,TS val 178388396 ecr 2950868390], length 9576
21:05:18.239756 IP6 me.33906 > server.edu.https: Flags [.], ack 49612, win 929, options [nop,nop,TS val 2950868416 ecr 178388396], length 0
21:05:18.257299 IP6 server.edu.https > me.33906: Flags [.], seq 49612:52348, ack 1325, win 501, options [nop,nop,TS val 178388416 ecr 2950868402], length 2736
21:05:18.257331 IP6 me.33906 > server.edu.https: Flags [.], ack 52348, win 972, options [nop,nop,TS val 2950868433 ecr 178388416], length 0
21:05:18.280192 IP6 server.edu.https > me.33906: Flags [.], seq 52348:56452, ack 1325, win 501, options [nop,nop,TS val 178388440 ecr 2950868414], length 4104
21:05:18.280223 IP6 me.33906 > server.edu.https: Flags [.], ack 56452, win 1036, options [nop,nop,TS val 2950868456 ecr 178388440], length 0
21:05:18.281779 IP6 server.edu.https > me.33906: Flags [.], seq 56452:57820, ack 1325, win 501, options [nop,nop,TS val 178388440 ecr 2950868414], length 1368
21:05:18.281796 IP6 server.edu.https > me.33906: Flags [.], seq 57820:72868, ack 1325, win 501, options [nop,nop,TS val 178388440 ecr 2950868416], length 15048
21:05:18.281845 IP6 me.33906 > server.edu.https: Flags [.], ack 57820, win 1058, options [nop,nop,TS val 2950868458 ecr 178388440], length 0
21:05:18.281885 IP6 me.33906 > server.edu.https: Flags [.], ack 72868, win 1023, options [nop,nop,TS val 2950868458 ecr 178388440], length 0
21:05:18.283103 IP6 server.edu.https > me.33906: Flags [P.], seq 72868:90345, ack 1325, win 501, options [nop,nop,TS val 178388440 ecr 2950868416], length 17477
21:05:18.283132 IP6 me.33906 > server.edu.https: Flags [.], ack 90345, win 1014, options [nop,nop,TS val 2950868459 ecr 178388440], length 0
21:05:23.310920 IP6 server.edu.https > me.33906: Flags [P.], seq 90345:90391, ack 1325, win 501, options [nop,nop,TS val 178393397 ecr 2950868459], length 46
21:05:23.310934 IP6 server.edu.https > me.33906: Flags [P.], seq 90391:90415, ack 1325, win 501, options [nop,nop,TS val 178393397 ecr 2950868459], length 24
21:05:23.310936 IP6 server.edu.https > me.33906: Flags [F.], seq 90415, ack 1325, win 501, options [nop,nop,TS val 178393397 ecr 2950868459], length 0
21:05:23.310976 IP6 me.33906 > server.edu.https: Flags [.], ack 90391, win 1058, options [nop,nop,TS val 2950873487 ecr 178393397], length 0
21:05:23.311021 IP6 me.33906 > server.edu.https: Flags [.], ack 90415, win 1058, options [nop,nop,TS val 2950873487 ecr 178393397], length 0
21:05:23.311228 IP6 me.33906 > server.edu.https: Flags [P.], seq 1325:1364, ack 90416, win 1058, options [nop,nop,TS val 2950873487 ecr 178393397], length 39
21:05:23.311577 IP6 me.33906 > server.edu.https: Flags [FP.], seq 1364:1388, ack 90416, win 1058, options [nop,nop,TS val 2950873487 ecr 178393397], length 24
21:05:23.346524 IP6 server.edu.https > me.33906: Flags [.], ack 1364, win 501, options [nop,nop,TS val 178393503 ecr 2950873487], length 0
21:05:23.398254 IP6 server.edu.https > me.33906: Flags [.], ack 1389, win 501, options [nop,nop,TS val 178393557 ecr 2950873487], length 0

```
Thank you for your suggestions and answers. It is interesting to see the messages that are being sent between my computer and the server. The VPN used together with a very slow server problem seems to be relatively unique. Without the VPN it fortunately works very good and I can go through the feed again with comfort :D

**Comment by Minoru** [comment]
Thanks!

> I tried to capture the same thing with wireshark to find out what is send, but it doesn't contain readable information and only says "Application Data":

That's expected: the connection is encrypted, and only the client (Firefox, Newsboat etc.) and the server have the decryption key. Even you, running a program at the same machine, can't read that data. You can [instruct Firefox to give you the TLS key](https://gitlab.com/wireshark/wireshark/-/wikis/TLS#tls-decryption) so you can read the data in Wireshark. Newsboat uses libcurl, so perhaps it'll work for Newsboat too (but I didn't check).

Anyway, none of our guesses worked so far, and I feel that we're getting diminishing returns: it gets harder to gather more facts, and those facts are less and less insightful. Ultimately, we can only fix Newsboat if we know what it's doing wrong. We could keep guessing and maybe find the cause, but the chances are slim IMHO. The best solution would be for the server admins to look at Newsboat-over-VPN connection from their end, and tell us why the server closes that connection. If that's not possible, I'd just close the issue.

(Unless @dennisschagt has more guesses to try out? I'm totally fine with this being open as long as there's some movement, but if this stalls, I'd prefer to close.)

**Comment by dennisschagt** [comment]
> You can instruct Firefox to give you the TLS key so you can read the data in Wireshark. Newsboat uses libcurl, so perhaps it'll work for Newsboat too (but I didn't check).

Thanks for the suggestion, I wasn't aware of that possibility.

I still think it might be useful is to take a look at the data being transmitted 55-59 seconds after connection start (by Firefox), using the wireshark/TLS-key instructions mentioned by Minoru.
Other than that, I don't have any more guesses.

**Comment by Minoru** [comment]
@plsdosomething Ping? Would you like to try extracting keys from Firefox, and looking at the decrypted traffic, following the instructions I linked above?

**Comment by Minoru** [comment]
Okay, I think we did all we could on our end, so I'm closing this one.
